

================================================================
== Vitis HLS Report for 'lzBooster_255_16384_64_s'
================================================================
* Date:           Fri Oct 31 13:59:01 2025

* Version:        2024.2 (Build 5238294 on Nov  8 2024)
* Project:        lz4CompressEngineRun
* Solution:       hls (Vivado IP Flow Target)
* Product family: zynq
* Target device:  xc7z020-clg484-1


================================================================
== Performance Estimates
================================================================
+ Timing: 
    * Summary: 
    +--------+---------+----------+------------+
    |  Clock |  Target | Estimated| Uncertainty|
    +--------+---------+----------+------------+
    |ap_clk  |  7.00 ns|  6.300 ns|     0.70 ns|
    +--------+---------+----------+------------+

+ Latency: 
    * Summary: 
    +---------+---------+----------+----------+-----+-----+---------+
    |  Latency (cycles) |  Latency (absolute) |  Interval | Pipeline|
    |   min   |   max   |    min   |    max   | min | max |   Type  |
    +---------+---------+----------+----------+-----+-----+---------+
    |        ?|        ?|         ?|         ?|    ?|    ?|       no|
    +---------+---------+----------+----------+-----+-----+---------+

    + Detail: 
        * Instance: 
        N/A

        * Loop: 
        +-------------------------+---------+---------+----------+-----------+-----------+------+----------+
        |                         |  Latency (cycles) | Iteration|  Initiation Interval  | Trip |          |
        |        Loop Name        |   min   |   max   |  Latency |  achieved |   target  | Count| Pipelined|
        +-------------------------+---------+---------+----------+-----------+-----------+------+----------+
        |- lz_booster_left_bytes  |       64|       64|         1|          -|          -|    64|        no|
        +-------------------------+---------+---------+----------+-----------+-----------+------+----------+

============================================================
+ Verbose Summary: Synthesis Manager
============================================================
InlineROM: 1
ExposeGlobal: 0
============================================================
+ Verbose Summary: CDFG Model
============================================================
IsTopModel: 0
ResetActiveHigh: 1
IsCombinational: 2
IsDatapathOnly: 0
HasWiredReturn: 1
HasMFsm: 0
HasVarLatency: 1
IsPipeline: 0
IsRtlPipelined: 0
IsInstanceOverlapped: 0
IsDontTouch: 0
HasImplIP: 0
IsGatedGlobalClock: 0


============================================================
+ Verbose Summary: Schedule
============================================================
* Number of FSM states : 7
* Pipeline : 0
* Dataflow Pipeline: 0

* FSM state transitions: 
1 --> 2 7 
2 --> 3 
3 --> 4 
4 --> 5 
5 --> 6 
6 --> 7 
7 --> 7 

* FSM state operations: 

State 1 <SV = 0> <Delay = 6.30>
ST_1 : Operation 8 [1/1] (0.00ns)   --->   "%outValue_loc = alloca i64 1"   --->   Operation 8 'alloca' 'outValue_loc' <Predicate = true> <Delay = 0.00>
ST_1 : Operation 9 [1/1] (0.00ns)   --->   "%p_loc28 = alloca i64 1"   --->   Operation 9 'alloca' 'p_loc28' <Predicate = true> <Delay = 0.00>
ST_1 : Operation 10 [1/1] (0.00ns)   --->   "%new_match_len_loc = alloca i64 1"   --->   Operation 10 'alloca' 'new_match_len_loc' <Predicate = true> <Delay = 0.00>
ST_1 : Operation 11 [1/1] (0.00ns)   --->   "%new_matchFlag_1_0_0_07_loc = alloca i64 1"   --->   Operation 11 'alloca' 'new_matchFlag_1_0_0_07_loc' <Predicate = true> <Delay = 0.00>
ST_1 : Operation 12 [1/1] (0.00ns)   --->   "%p_loc = alloca i64 1"   --->   Operation 12 'alloca' 'p_loc' <Predicate = true> <Delay = 0.00>
ST_1 : Operation 13 [1/1] (0.00ns)   --->   "%new_match_loc_loc = alloca i64 1"   --->   Operation 13 'alloca' 'new_match_loc_loc' <Predicate = true> <Delay = 0.00>
ST_1 : Operation 14 [1/1] (0.00ns)   --->   "%specinterface_ln0 = specinterface void @_ssdm_op_SpecInterface, i32 %input_size, void @ap_fifo_str, i32 0, i32 0, void @p_str, i32 0, i32 0, void @p_str, void @p_str, void @p_str, i32 2, i32 2, i32 16, i32 16, void @p_str, void @ScalarProp_str, i32 4294967295, i32 0, i32 0"   --->   Operation 14 'specinterface' 'specinterface_ln0' <Predicate = true> <Delay = 0.00>
ST_1 : Operation 15 [1/1] ( I:3.15ns O:3.15ns )   --->   "%input_size_1 = read i32 @_ssdm_op_Read.ap_fifo.i32P0A, i32 %input_size"   --->   Operation 15 'read' 'input_size_1' <Predicate = true> <Delay = 3.15> <CoreInst = "FIFO_SRL">   --->   Core 80 'FIFO_SRL' <Latency = 0> <II = 1> <Delay = 3.63> <Storage> <Opcode : 'read' 'write' 'nbread' 'nbwrite'> <Ports = 0> <Width = 32> <Depth = 2> <FIFO>
ST_1 : Operation 16 [1/1] (0.00ns)   --->   "%specinterface_ln0 = specinterface void @_ssdm_op_SpecInterface, i32 %input_size_c, void @ap_fifo_str, i32 0, i32 0, void @p_str, i32 0, i32 0, void @p_str, void @p_str, void @p_str, i32 2, i32 2, i32 16, i32 16, void @p_str, void @ScalarProp_str, i32 4294967295, i32 0, i32 0"   --->   Operation 16 'specinterface' 'specinterface_ln0' <Predicate = true> <Delay = 0.00>
ST_1 : Operation 17 [1/1] ( I:3.15ns O:3.15ns )   --->   "%write_ln0 = write void @_ssdm_op_Write.ap_fifo.i32P0A, i32 %input_size_c, i32 %input_size_1"   --->   Operation 17 'write' 'write_ln0' <Predicate = true> <Delay = 3.15> <CoreInst = "FIFO_SRL">   --->   Core 80 'FIFO_SRL' <Latency = 0> <II = 1> <Delay = 3.63> <Storage> <Opcode : 'read' 'write' 'nbread' 'nbwrite'> <Ports = 0> <Width = 32> <Depth = 2> <FIFO>
ST_1 : Operation 18 [1/1] (0.00ns)   --->   "%specmemcore_ln0 = specmemcore void @_ssdm_op_SpecMemCore, i32 %boosterStream, i64 666, i64 10, i64 18446744073709551615"   --->   Operation 18 'specmemcore' 'specmemcore_ln0' <Predicate = true> <Delay = 0.00>
ST_1 : Operation 19 [1/1] (0.00ns)   --->   "%specinterface_ln0 = specinterface void @_ssdm_op_SpecInterface, i32 %boosterStream, void @empty_3, i32 0, i32 0, void @empty_4, i32 0, i32 0, void @empty_4, void @empty_4, void @empty_4, i32 0, i32 0, i32 0, i32 0, void @empty_4, void @empty_4, i32 4294967295, i32 0, i32 0"   --->   Operation 19 'specinterface' 'specinterface_ln0' <Predicate = true> <Delay = 0.00>
ST_1 : Operation 20 [1/1] (0.00ns)   --->   "%specinterface_ln0 = specinterface void @_ssdm_op_SpecInterface, i32 %bestMatchStream, void @empty_3, i32 0, i32 0, void @empty_4, i32 0, i32 0, void @empty_4, void @empty_4, void @empty_4, i32 0, i32 0, i32 0, i32 0, void @empty_4, void @empty_4, i32 4294967295, i32 0, i32 0"   --->   Operation 20 'specinterface' 'specinterface_ln0' <Predicate = true> <Delay = 0.00>
ST_1 : Operation 21 [1/1] (0.00ns)   --->   "%local_mem = alloca i64 1" [D:/Xillinx_Project/PROJECT/data_compression/L1/tests/lz4_compress/../../../L1/include/hw/lz_optional.hpp:609]   --->   Operation 21 'alloca' 'local_mem' <Predicate = true> <Delay = 0.00> <CoreInst = "RAM_2P_BRAM">   --->   Core 90 'RAM_2P_BRAM' <Latency = 1> <II = 1> <Delay = 3.25> <Storage> <Opcode : 'load' 'store'> <Ports = 2> <Width = 8> <Depth = 16384> <RAM>
ST_1 : Operation 22 [1/1] (2.55ns)   --->   "%icmp_ln608 = icmp_eq  i32 %input_size_1, i32 0" [D:/Xillinx_Project/PROJECT/data_compression/L1/tests/lz4_compress/../../../L1/include/hw/lz_optional.hpp:608]   --->   Operation 22 'icmp' 'icmp_ln608' <Predicate = true> <Delay = 2.55> <CoreInst = "Cmp">   --->   Core 9 'Cmp' <Latency = 0> <II = 1> <Delay = 2.55> <FuncUnit> <Opcode : 'seteq' 'setne' 'setle' 'setge' 'setlt' 'setgt'> <InPorts = 2> <OutPorts = 1>
ST_1 : Operation 23 [1/1] (0.00ns)   --->   "%br_ln608 = br i1 %icmp_ln608, void %if.end, void %return" [D:/Xillinx_Project/PROJECT/data_compression/L1/tests/lz4_compress/../../../L1/include/hw/lz_optional.hpp:608]   --->   Operation 23 'br' 'br_ln608' <Predicate = true> <Delay = 0.00>

State 2 <SV = 1> <Delay = 3.25>
ST_2 : Operation 24 [1/1] (0.00ns)   --->   "%specmemcore_ln610 = specmemcore void @_ssdm_op_SpecMemCore, i8 %local_mem, i64 666, i64 22, i64 18446744073709551615" [D:/Xillinx_Project/PROJECT/data_compression/L1/tests/lz4_compress/../../../L1/include/hw/lz_optional.hpp:610]   --->   Operation 24 'specmemcore' 'specmemcore_ln610' <Predicate = true> <Delay = 0.00>
ST_2 : Operation 25 [1/1] (0.00ns)   --->   "%guard_variable_for_void_lzBooster_stream_stream_unsigned_int_nextMatchCh_load = load i1 %guard_variable_for_void_lzBooster_stream_stream_unsigned_int_nextMatchCh" [D:/Xillinx_Project/PROJECT/data_compression/L1/tests/lz4_compress/../../../L1/include/hw/lz_optional.hpp:621]   --->   Operation 25 'load' 'guard_variable_for_void_lzBooster_stream_stream_unsigned_int_nextMatchCh_load' <Predicate = true> <Delay = 0.00>
ST_2 : Operation 26 [1/1] (0.00ns)   --->   "%match_loc_reg_load = load i32 %match_loc_reg" [D:/Xillinx_Project/PROJECT/data_compression/L1/tests/lz4_compress/../../../L1/include/hw/lz_optional.hpp:621]   --->   Operation 26 'load' 'match_loc_reg_load' <Predicate = true> <Delay = 0.00>
ST_2 : Operation 27 [1/1] (0.00ns)   --->   "%trunc_ln680 = trunc i32 %match_loc_reg_load" [D:/Xillinx_Project/PROJECT/data_compression/L1/tests/lz4_compress/../../../L1/include/hw/lz_optional.hpp:680]   --->   Operation 27 'trunc' 'trunc_ln680' <Predicate = true> <Delay = 0.00>
ST_2 : Operation 28 [1/1] (0.00ns)   --->   "%nextMatchCh_load = load i8 %nextMatchCh" [D:/Xillinx_Project/PROJECT/data_compression/L1/tests/lz4_compress/../../../L1/include/hw/lz_optional.hpp:680]   --->   Operation 28 'load' 'nextMatchCh_load' <Predicate = true> <Delay = 0.00>
ST_2 : Operation 29 [1/1] (1.58ns)   --->   "%br_ln621 = br i1 %guard_variable_for_void_lzBooster_stream_stream_unsigned_int_nextMatchCh_load, void %init.check11, void %lz_booster" [D:/Xillinx_Project/PROJECT/data_compression/L1/tests/lz4_compress/../../../L1/include/hw/lz_optional.hpp:621]   --->   Operation 29 'br' 'br_ln621' <Predicate = true> <Delay = 1.58>
ST_2 : Operation 30 [1/1] (0.00ns)   --->   "%zext_ln621 = zext i14 %trunc_ln680" [D:/Xillinx_Project/PROJECT/data_compression/L1/tests/lz4_compress/../../../L1/include/hw/lz_optional.hpp:621]   --->   Operation 30 'zext' 'zext_ln621' <Predicate = (!guard_variable_for_void_lzBooster_stream_stream_unsigned_int_nextMatchCh_load)> <Delay = 0.00>
ST_2 : Operation 31 [1/1] (0.00ns)   --->   "%local_mem_addr = getelementptr i8 %local_mem, i64 0, i64 %zext_ln621" [D:/Xillinx_Project/PROJECT/data_compression/L1/tests/lz4_compress/../../../L1/include/hw/lz_optional.hpp:621]   --->   Operation 31 'getelementptr' 'local_mem_addr' <Predicate = (!guard_variable_for_void_lzBooster_stream_stream_unsigned_int_nextMatchCh_load)> <Delay = 0.00>
ST_2 : Operation 32 [2/2] (3.25ns)   --->   "%local_mem_load = load i14 %local_mem_addr" [D:/Xillinx_Project/PROJECT/data_compression/L1/tests/lz4_compress/../../../L1/include/hw/lz_optional.hpp:621]   --->   Operation 32 'load' 'local_mem_load' <Predicate = (!guard_variable_for_void_lzBooster_stream_stream_unsigned_int_nextMatchCh_load)> <Delay = 3.25> <CoreInst = "RAM_2P_BRAM">   --->   Core 90 'RAM_2P_BRAM' <Latency = 1> <II = 1> <Delay = 3.25> <Storage> <Opcode : 'load' 'store'> <Ports = 2> <Width = 8> <Depth = 16384> <RAM>

State 3 <SV = 2> <Delay = 3.25>
ST_3 : Operation 33 [1/2] ( I:3.25ns O:3.25ns )   --->   "%local_mem_load = load i14 %local_mem_addr" [D:/Xillinx_Project/PROJECT/data_compression/L1/tests/lz4_compress/../../../L1/include/hw/lz_optional.hpp:621]   --->   Operation 33 'load' 'local_mem_load' <Predicate = (!guard_variable_for_void_lzBooster_stream_stream_unsigned_int_nextMatchCh_load)> <Delay = 3.25> <CoreInst = "RAM_2P_BRAM">   --->   Core 90 'RAM_2P_BRAM' <Latency = 1> <II = 1> <Delay = 3.25> <Storage> <Opcode : 'load' 'store'> <Ports = 2> <Width = 8> <Depth = 16384> <RAM>
ST_3 : Operation 34 [1/1] (0.00ns)   --->   "%store_ln621 = store i1 1, i1 %guard_variable_for_void_lzBooster_stream_stream_unsigned_int_nextMatchCh" [D:/Xillinx_Project/PROJECT/data_compression/L1/tests/lz4_compress/../../../L1/include/hw/lz_optional.hpp:621]   --->   Operation 34 'store' 'store_ln621' <Predicate = (!guard_variable_for_void_lzBooster_stream_stream_unsigned_int_nextMatchCh_load)> <Delay = 0.00>
ST_3 : Operation 35 [1/1] (1.58ns)   --->   "%br_ln621 = br void %lz_booster" [D:/Xillinx_Project/PROJECT/data_compression/L1/tests/lz4_compress/../../../L1/include/hw/lz_optional.hpp:621]   --->   Operation 35 'br' 'br_ln621' <Predicate = (!guard_variable_for_void_lzBooster_stream_stream_unsigned_int_nextMatchCh_load)> <Delay = 1.58>
ST_3 : Operation 36 [1/1] (0.00ns)   --->   "%fence_ln624 = fence void @_ssdm_op_Fence, i32 %input_size, i32 %input_size_c, i32 4294967295, i32 %bestMatchStream, i32 %boosterStream" [D:/Xillinx_Project/PROJECT/data_compression/L1/tests/lz4_compress/../../../L1/include/hw/lz_optional.hpp:624]   --->   Operation 36 'fence' 'fence_ln624' <Predicate = true> <Delay = 0.00>

State 4 <SV = 3> <Delay = 5.10>
ST_4 : Operation 37 [1/1] (0.00ns)   --->   "%nextMatchCh_loc_0 = phi i8 %local_mem_load, void %init.check11, i8 %nextMatchCh_load, void %if.end" [D:/Xillinx_Project/PROJECT/data_compression/L1/tests/lz4_compress/../../../L1/include/hw/lz_optional.hpp:621]   --->   Operation 37 'phi' 'nextMatchCh_loc_0' <Predicate = true> <Delay = 0.00>
ST_4 : Operation 38 [1/1] (2.55ns)   --->   "%sub = add i32 %input_size_1, i32 4294967232"   --->   Operation 38 'add' 'sub' <Predicate = true> <Delay = 2.55> <CoreInst = "Adder">   --->   Core 1 'Adder' <Latency = 0> <II = 1> <Delay = 2.55> <FuncUnit> <Opcode : 'add' 'sub'> <InPorts = 2> <OutPorts = 1>
ST_4 : Operation 39 [1/1] (2.55ns)   --->   "%icmp_ln624 = icmp_eq  i32 %sub, i32 0" [D:/Xillinx_Project/PROJECT/data_compression/L1/tests/lz4_compress/../../../L1/include/hw/lz_optional.hpp:624]   --->   Operation 39 'icmp' 'icmp_ln624' <Predicate = true> <Delay = 2.55> <CoreInst = "Cmp">   --->   Core 9 'Cmp' <Latency = 0> <II = 1> <Delay = 2.55> <FuncUnit> <Opcode : 'seteq' 'setne' 'setle' 'setge' 'setlt' 'setgt'> <InPorts = 2> <OutPorts = 1>
ST_4 : Operation 40 [1/1] (0.00ns)   --->   "%skip_len_reg_load = load i16 %skip_len_reg" [D:/Xillinx_Project/PROJECT/data_compression/L1/tests/lz4_compress/../../../L1/include/hw/lz_optional.hpp:651]   --->   Operation 40 'load' 'skip_len_reg_load' <Predicate = true> <Delay = 0.00>
ST_4 : Operation 41 [1/1] (0.00ns)   --->   "%match_len_reg_load = load i32 %match_len_reg" [D:/Xillinx_Project/PROJECT/data_compression/L1/tests/lz4_compress/../../../L1/include/hw/lz_optional.hpp:653]   --->   Operation 41 'load' 'match_len_reg_load' <Predicate = true> <Delay = 0.00>
ST_4 : Operation 42 [1/1] (0.00ns)   --->   "%matchFlag_reg_load = load i1 %matchFlag_reg" [D:/Xillinx_Project/PROJECT/data_compression/L1/tests/lz4_compress/../../../L1/include/hw/lz_optional.hpp:673]   --->   Operation 42 'load' 'matchFlag_reg_load' <Predicate = true> <Delay = 0.00>
ST_4 : Operation 43 [2/2] (2.55ns)   --->   "%call_ln621 = call void @lzBooster<255, 16384, 64>_Pipeline_lz_booster, i32 %match_loc_reg_load, i8 %nextMatchCh_loc_0, i1 %matchFlag_reg_load, i32 %match_len_reg_load, i16 %skip_len_reg_load, i32 %sub, i8 %local_mem, i32 %bestMatchStream, i32 %boosterStream, i32 %new_match_loc_loc, i8 %p_loc, i1 %new_matchFlag_1_0_0_07_loc, i32 %new_match_len_loc, i16 %p_loc28, i32 %outValue_loc" [D:/Xillinx_Project/PROJECT/data_compression/L1/tests/lz4_compress/../../../L1/include/hw/lz_optional.hpp:621]   --->   Operation 43 'call' 'call_ln621' <Predicate = true> <Delay = 2.55> <CoreType = "Generic">   --->   Generic Core

State 5 <SV = 4> <Delay = 0.00>
ST_5 : Operation 44 [1/2] (0.00ns)   --->   "%call_ln621 = call void @lzBooster<255, 16384, 64>_Pipeline_lz_booster, i32 %match_loc_reg_load, i8 %nextMatchCh_loc_0, i1 %matchFlag_reg_load, i32 %match_len_reg_load, i16 %skip_len_reg_load, i32 %sub, i8 %local_mem, i32 %bestMatchStream, i32 %boosterStream, i32 %new_match_loc_loc, i8 %p_loc, i1 %new_matchFlag_1_0_0_07_loc, i32 %new_match_len_loc, i16 %p_loc28, i32 %outValue_loc" [D:/Xillinx_Project/PROJECT/data_compression/L1/tests/lz4_compress/../../../L1/include/hw/lz_optional.hpp:621]   --->   Operation 44 'call' 'call_ln621' <Predicate = true> <Delay = 0.00> <CoreType = "Generic">   --->   Generic Core

State 6 <SV = 5> <Delay = 3.15>
ST_6 : Operation 45 [1/1] (0.00ns)   --->   "%nextMatchCh_flag_0 = phi i1 1, void %init.check11, i1 0, void %if.end"   --->   Operation 45 'phi' 'nextMatchCh_flag_0' <Predicate = true> <Delay = 0.00>
ST_6 : Operation 46 [1/1] (0.00ns)   --->   "%new_match_loc_loc_load = load i32 %new_match_loc_loc"   --->   Operation 46 'load' 'new_match_loc_loc_load' <Predicate = true> <Delay = 0.00>
ST_6 : Operation 47 [1/1] (0.00ns)   --->   "%p_loc_load = load i8 %p_loc"   --->   Operation 47 'load' 'p_loc_load' <Predicate = true> <Delay = 0.00>
ST_6 : Operation 48 [1/1] (0.00ns)   --->   "%new_matchFlag_1_0_0_07_loc_load = load i1 %new_matchFlag_1_0_0_07_loc"   --->   Operation 48 'load' 'new_matchFlag_1_0_0_07_loc_load' <Predicate = true> <Delay = 0.00>
ST_6 : Operation 49 [1/1] (0.00ns)   --->   "%new_match_len_loc_load = load i32 %new_match_len_loc"   --->   Operation 49 'load' 'new_match_len_loc_load' <Predicate = true> <Delay = 0.00>
ST_6 : Operation 50 [1/1] (0.00ns)   --->   "%p_loc28_load = load i16 %p_loc28"   --->   Operation 50 'load' 'p_loc28_load' <Predicate = true> <Delay = 0.00>
ST_6 : Operation 51 [1/1] (0.00ns)   --->   "%outValue_loc_load = load i32 %outValue_loc"   --->   Operation 51 'load' 'outValue_loc_load' <Predicate = true> <Delay = 0.00>
ST_6 : Operation 52 [1/1] (1.58ns)   --->   "%br_ln624 = br i1 %icmp_ln624, void %for.cond.for.cond.cleanup_crit_edge.split, void %for.end" [D:/Xillinx_Project/PROJECT/data_compression/L1/tests/lz4_compress/../../../L1/include/hw/lz_optional.hpp:624]   --->   Operation 52 'br' 'br_ln624' <Predicate = true> <Delay = 1.58>
ST_6 : Operation 53 [1/1] (0.00ns)   --->   "%store_ln651 = store i16 %p_loc28_load, i16 %skip_len_reg" [D:/Xillinx_Project/PROJECT/data_compression/L1/tests/lz4_compress/../../../L1/include/hw/lz_optional.hpp:651]   --->   Operation 53 'store' 'store_ln651' <Predicate = (!icmp_ln624)> <Delay = 0.00>
ST_6 : Operation 54 [1/1] (0.00ns)   --->   "%store_ln653 = store i32 %new_match_len_loc_load, i32 %match_len_reg" [D:/Xillinx_Project/PROJECT/data_compression/L1/tests/lz4_compress/../../../L1/include/hw/lz_optional.hpp:653]   --->   Operation 54 'store' 'store_ln653' <Predicate = (!icmp_ln624)> <Delay = 0.00>
ST_6 : Operation 55 [1/1] (0.00ns)   --->   "%store_ln673 = store i1 %new_matchFlag_1_0_0_07_loc_load, i1 %matchFlag_reg" [D:/Xillinx_Project/PROJECT/data_compression/L1/tests/lz4_compress/../../../L1/include/hw/lz_optional.hpp:673]   --->   Operation 55 'store' 'store_ln673' <Predicate = (!icmp_ln624)> <Delay = 0.00>
ST_6 : Operation 56 [1/1] (0.00ns)   --->   "%store_ln654 = store i32 %new_match_loc_loc_load, i32 %match_loc_reg" [D:/Xillinx_Project/PROJECT/data_compression/L1/tests/lz4_compress/../../../L1/include/hw/lz_optional.hpp:654]   --->   Operation 56 'store' 'store_ln654' <Predicate = (!icmp_ln624)> <Delay = 0.00>
ST_6 : Operation 57 [1/1] (1.58ns)   --->   "%br_ln624 = br void %for.end" [D:/Xillinx_Project/PROJECT/data_compression/L1/tests/lz4_compress/../../../L1/include/hw/lz_optional.hpp:624]   --->   Operation 57 'br' 'br_ln624' <Predicate = (!icmp_ln624)> <Delay = 1.58>
ST_6 : Operation 58 [1/1] (0.00ns)   --->   "%nextMatchCh_flag_1 = phi i1 %nextMatchCh_flag_0, void %lz_booster, i1 1, void %for.cond.for.cond.cleanup_crit_edge.split"   --->   Operation 58 'phi' 'nextMatchCh_flag_1' <Predicate = true> <Delay = 0.00>
ST_6 : Operation 59 [1/1] (0.00ns)   --->   "%nextMatchCh_new_1 = phi i8 %nextMatchCh_loc_0, void %lz_booster, i8 %p_loc_load, void %for.cond.for.cond.cleanup_crit_edge.split" [D:/Xillinx_Project/PROJECT/data_compression/L1/tests/lz4_compress/../../../L1/include/hw/lz_optional.hpp:621]   --->   Operation 59 'phi' 'nextMatchCh_new_1' <Predicate = true> <Delay = 0.00>
ST_6 : Operation 60 [1/1] ( I:3.15ns O:3.15ns )   --->   "%write_ln685 = write void @_ssdm_op_Write.ap_fifo.volatile.i32P0A, i32 %boosterStream, i32 %outValue_loc_load" [D:/Xillinx_Project/PROJECT/data_compression/L1/tests/lz4_compress/../../../L1/include/hw/lz_optional.hpp:685]   --->   Operation 60 'write' 'write_ln685' <Predicate = true> <Delay = 3.15> <CoreInst = "FIFO_SRL">   --->   Core 80 'FIFO_SRL' <Latency = 0> <II = 1> <Delay = 3.54> <Storage> <Opcode : 'read' 'write' 'nbread' 'nbwrite'> <Ports = 0> <Width = 32> <Depth = 8> <FIFO>
ST_6 : Operation 61 [1/1] (0.00ns)   --->   "%br_ln0 = br i1 %nextMatchCh_flag_1, void %for.end.new, void %mergeST"   --->   Operation 61 'br' 'br_ln0' <Predicate = true> <Delay = 0.00>
ST_6 : Operation 62 [1/1] (0.00ns)   --->   "%store_ln621 = store i8 %nextMatchCh_new_1, i8 %nextMatchCh" [D:/Xillinx_Project/PROJECT/data_compression/L1/tests/lz4_compress/../../../L1/include/hw/lz_optional.hpp:621]   --->   Operation 62 'store' 'store_ln621' <Predicate = (nextMatchCh_flag_1)> <Delay = 0.00>
ST_6 : Operation 63 [1/1] (0.00ns)   --->   "%br_ln0 = br void %for.end.new"   --->   Operation 63 'br' 'br_ln0' <Predicate = (nextMatchCh_flag_1)> <Delay = 0.00>
ST_6 : Operation 64 [1/1] (0.00ns)   --->   "%i_4 = alloca i32 1" [D:/Xillinx_Project/PROJECT/data_compression/L1/tests/lz4_compress/../../../L1/include/hw/lz_optional.hpp:687]   --->   Operation 64 'alloca' 'i_4' <Predicate = true> <Delay = 0.00>
ST_6 : Operation 65 [1/1] (1.58ns)   --->   "%store_ln687 = store i7 0, i7 %i_4" [D:/Xillinx_Project/PROJECT/data_compression/L1/tests/lz4_compress/../../../L1/include/hw/lz_optional.hpp:687]   --->   Operation 65 'store' 'store_ln687' <Predicate = true> <Delay = 1.58>
ST_6 : Operation 66 [1/1] (0.00ns)   --->   "%br_ln687 = br void %for.inc76" [D:/Xillinx_Project/PROJECT/data_compression/L1/tests/lz4_compress/../../../L1/include/hw/lz_optional.hpp:687]   --->   Operation 66 'br' 'br_ln687' <Predicate = true> <Delay = 0.00>

State 7 <SV = 6> <Delay = 6.30>
ST_7 : Operation 67 [1/1] (0.00ns)   --->   "%i = load i7 %i_4" [D:/Xillinx_Project/PROJECT/data_compression/L1/tests/lz4_compress/../../../L1/include/hw/lz_optional.hpp:687]   --->   Operation 67 'load' 'i' <Predicate = (!icmp_ln608)> <Delay = 0.00>
ST_7 : Operation 68 [1/1] (1.87ns)   --->   "%icmp_ln687 = icmp_eq  i7 %i, i7 64" [D:/Xillinx_Project/PROJECT/data_compression/L1/tests/lz4_compress/../../../L1/include/hw/lz_optional.hpp:687]   --->   Operation 68 'icmp' 'icmp_ln687' <Predicate = (!icmp_ln608)> <Delay = 1.87> <CoreInst = "Cmp">   --->   Core 9 'Cmp' <Latency = 0> <II = 1> <Delay = 1.87> <FuncUnit> <Opcode : 'seteq' 'setne' 'setle' 'setge' 'setlt' 'setgt'> <InPorts = 2> <OutPorts = 1>
ST_7 : Operation 69 [1/1] (1.87ns)   --->   "%i_6 = add i7 %i, i7 1" [D:/Xillinx_Project/PROJECT/data_compression/L1/tests/lz4_compress/../../../L1/include/hw/lz_optional.hpp:687]   --->   Operation 69 'add' 'i_6' <Predicate = (!icmp_ln608)> <Delay = 1.87> <CoreInst = "Adder">   --->   Core 1 'Adder' <Latency = 0> <II = 1> <Delay = 1.87> <FuncUnit> <Opcode : 'add' 'sub'> <InPorts = 2> <OutPorts = 1>
ST_7 : Operation 70 [1/1] (0.00ns)   --->   "%br_ln687 = br i1 %icmp_ln687, void %for.inc76.split, void %return.loopexit" [D:/Xillinx_Project/PROJECT/data_compression/L1/tests/lz4_compress/../../../L1/include/hw/lz_optional.hpp:687]   --->   Operation 70 'br' 'br_ln687' <Predicate = (!icmp_ln608)> <Delay = 0.00>
ST_7 : Operation 71 [1/1] (0.00ns)   --->   "%specpipeline_ln688 = specpipeline void @_ssdm_op_SpecPipeline, i32 0, i32 0, i32 1, i32 0, void @empty_4" [D:/Xillinx_Project/PROJECT/data_compression/L1/tests/lz4_compress/../../../L1/include/hw/lz_optional.hpp:688]   --->   Operation 71 'specpipeline' 'specpipeline_ln688' <Predicate = (!icmp_ln608 & !icmp_ln687)> <Delay = 0.00>
ST_7 : Operation 72 [1/1] (0.00ns)   --->   "%speclooptripcount_ln687 = speclooptripcount void @_ssdm_op_SpecLoopTripCount, i64 64, i64 64, i64 64" [D:/Xillinx_Project/PROJECT/data_compression/L1/tests/lz4_compress/../../../L1/include/hw/lz_optional.hpp:687]   --->   Operation 72 'speclooptripcount' 'speclooptripcount_ln687' <Predicate = (!icmp_ln608 & !icmp_ln687)> <Delay = 0.00>
ST_7 : Operation 73 [1/1] (0.00ns)   --->   "%specloopname_ln687 = specloopname void @_ssdm_op_SpecLoopName, void @empty_8" [D:/Xillinx_Project/PROJECT/data_compression/L1/tests/lz4_compress/../../../L1/include/hw/lz_optional.hpp:687]   --->   Operation 73 'specloopname' 'specloopname_ln687' <Predicate = (!icmp_ln608 & !icmp_ln687)> <Delay = 0.00>
ST_7 : Operation 74 [1/1] ( I:3.15ns O:3.15ns )   --->   "%bestMatchStream_read = read i32 @_ssdm_op_Read.ap_fifo.volatile.i32P0A, i32 %bestMatchStream" [D:/Xillinx_Project/PROJECT/data_compression/L1/tests/lz4_compress/../../../L1/include/hw/lz_optional.hpp:689]   --->   Operation 74 'read' 'bestMatchStream_read' <Predicate = (!icmp_ln608 & !icmp_ln687)> <Delay = 3.15> <CoreInst = "FIFO_SRL">   --->   Core 80 'FIFO_SRL' <Latency = 0> <II = 1> <Delay = 3.54> <Storage> <Opcode : 'read' 'write' 'nbread' 'nbwrite'> <Ports = 0> <Width = 32> <Depth = 8> <FIFO>
ST_7 : Operation 75 [1/1] ( I:3.15ns O:3.15ns )   --->   "%write_ln689 = write void @_ssdm_op_Write.ap_fifo.volatile.i32P0A, i32 %boosterStream, i32 %bestMatchStream_read" [D:/Xillinx_Project/PROJECT/data_compression/L1/tests/lz4_compress/../../../L1/include/hw/lz_optional.hpp:689]   --->   Operation 75 'write' 'write_ln689' <Predicate = (!icmp_ln608 & !icmp_ln687)> <Delay = 3.15> <CoreInst = "FIFO_SRL">   --->   Core 80 'FIFO_SRL' <Latency = 0> <II = 1> <Delay = 3.54> <Storage> <Opcode : 'read' 'write' 'nbread' 'nbwrite'> <Ports = 0> <Width = 32> <Depth = 8> <FIFO>
ST_7 : Operation 76 [1/1] (1.58ns)   --->   "%store_ln687 = store i7 %i_6, i7 %i_4" [D:/Xillinx_Project/PROJECT/data_compression/L1/tests/lz4_compress/../../../L1/include/hw/lz_optional.hpp:687]   --->   Operation 76 'store' 'store_ln687' <Predicate = (!icmp_ln608 & !icmp_ln687)> <Delay = 1.58>
ST_7 : Operation 77 [1/1] (0.00ns)   --->   "%br_ln687 = br void %for.inc76" [D:/Xillinx_Project/PROJECT/data_compression/L1/tests/lz4_compress/../../../L1/include/hw/lz_optional.hpp:687]   --->   Operation 77 'br' 'br_ln687' <Predicate = (!icmp_ln608 & !icmp_ln687)> <Delay = 0.00>
ST_7 : Operation 78 [1/1] (0.00ns)   --->   "%br_ln0 = br void %return"   --->   Operation 78 'br' 'br_ln0' <Predicate = (!icmp_ln608 & icmp_ln687)> <Delay = 0.00>
ST_7 : Operation 79 [1/1] (0.00ns)   --->   "%ret_ln691 = ret" [D:/Xillinx_Project/PROJECT/data_compression/L1/tests/lz4_compress/../../../L1/include/hw/lz_optional.hpp:691]   --->   Operation 79 'ret' 'ret_ln691' <Predicate = (icmp_ln687) | (icmp_ln608)> <Delay = 0.00>


============================================================
+ Verbose Summary: Timing violations
============================================================
Target clock period: 7.000ns, clock uncertainty: 0.700ns.

 <State 1>: 6.300ns
The critical path consists of the following:
	fifo read operation ('input_size') on port 'input_size' [18]  (3.150 ns)
	fifo write operation ('write_ln0') on port 'input_size_c' [20]  (3.150 ns)

 <State 2>: 3.254ns
The critical path consists of the following:
	'load' operation 32 bit ('match_loc_reg_load', D:/Xillinx_Project/PROJECT/data_compression/L1/tests/lz4_compress/../../../L1/include/hw/lz_optional.hpp:621) on static variable 'match_loc_reg' [30]  (0.000 ns)
	'getelementptr' operation 14 bit ('local_mem_addr', D:/Xillinx_Project/PROJECT/data_compression/L1/tests/lz4_compress/../../../L1/include/hw/lz_optional.hpp:621) [36]  (0.000 ns)
	'load' operation 8 bit ('local_mem_load', D:/Xillinx_Project/PROJECT/data_compression/L1/tests/lz4_compress/../../../L1/include/hw/lz_optional.hpp:621) on array 'local_mem', D:/Xillinx_Project/PROJECT/data_compression/L1/tests/lz4_compress/../../../L1/include/hw/lz_optional.hpp:609 [37]  (3.254 ns)

 <State 3>: 3.254ns
The critical path consists of the following:
	'load' operation 8 bit ('local_mem_load', D:/Xillinx_Project/PROJECT/data_compression/L1/tests/lz4_compress/../../../L1/include/hw/lz_optional.hpp:621) on array 'local_mem', D:/Xillinx_Project/PROJECT/data_compression/L1/tests/lz4_compress/../../../L1/include/hw/lz_optional.hpp:609 [37]  (3.254 ns)

 <State 4>: 5.104ns
The critical path consists of the following:
	'add' operation 32 bit ('sub') [43]  (2.552 ns)
	'icmp' operation 1 bit ('icmp_ln624', D:/Xillinx_Project/PROJECT/data_compression/L1/tests/lz4_compress/../../../L1/include/hw/lz_optional.hpp:624) [44]  (2.552 ns)

 <State 5>: 0.000ns
The critical path consists of the following:

 <State 6>: 3.150ns
The critical path consists of the following:
	'load' operation 32 bit ('outValue_loc_load') on local variable 'outValue_loc' [55]  (0.000 ns)
	fifo write operation ('write_ln685', D:/Xillinx_Project/PROJECT/data_compression/L1/tests/lz4_compress/../../../L1/include/hw/lz_optional.hpp:685) on port 'boosterStream' (D:/Xillinx_Project/PROJECT/data_compression/L1/tests/lz4_compress/../../../L1/include/hw/lz_optional.hpp:685) [66]  (3.150 ns)

 <State 7>: 6.300ns
The critical path consists of the following:
	'load' operation 7 bit ('i', D:/Xillinx_Project/PROJECT/data_compression/L1/tests/lz4_compress/../../../L1/include/hw/lz_optional.hpp:687) on local variable 'i', D:/Xillinx_Project/PROJECT/data_compression/L1/tests/lz4_compress/../../../L1/include/hw/lz_optional.hpp:687 [76]  (0.000 ns)
	'icmp' operation 1 bit ('icmp_ln687', D:/Xillinx_Project/PROJECT/data_compression/L1/tests/lz4_compress/../../../L1/include/hw/lz_optional.hpp:687) [77]  (1.870 ns)
	fifo read operation ('bestMatchStream_read', D:/Xillinx_Project/PROJECT/data_compression/L1/tests/lz4_compress/../../../L1/include/hw/lz_optional.hpp:689) on port 'bestMatchStream' (D:/Xillinx_Project/PROJECT/data_compression/L1/tests/lz4_compress/../../../L1/include/hw/lz_optional.hpp:689) [84]  (3.150 ns)
	fifo write operation ('write_ln689', D:/Xillinx_Project/PROJECT/data_compression/L1/tests/lz4_compress/../../../L1/include/hw/lz_optional.hpp:689) on port 'boosterStream' (D:/Xillinx_Project/PROJECT/data_compression/L1/tests/lz4_compress/../../../L1/include/hw/lz_optional.hpp:689) [85]  (3.150 ns)


============================================================
+ Verbose Summary: Binding
============================================================
N/A
* FSMD analyzer results:
  - Output states:
 - Input state : 
  - Chain level:
	State 1
	State 2
	State 3
	State 4
	State 5
	State 6
	State 7


============================================================
+ Verbose Summary: Datapath Resource usage 
============================================================
N/A
